{
  "generatedAt": "2026-10-22T12:42:57.781+11:00",
  "timezone": "Australia/Sydney",
  "schemaVersion": 1,
  "canteen": {
    "signupId": 66263752,
    "title": "Canteen Volunteer Term 4 2026",
    "signupUrl": "https://www.signupgenius.com/go/10C084EACAF2BA0FDC43-66263752-canteen",
    "days": [
      {
        "date": "2026-10-22",
        "weekday": "Thursday",
        "status": "red",
        "capacity": 6,
        "filled": 0,
        "fillPct": 0,
        "deepLink": "https://www.signupgenius.com/go/10C084EACAF2BA0FDC43-66263752-canteen#/#842709438-date-wrap",
        "shifts": [
          {
            "label": "10am - 12pm",
            "capacity": 3,
            "filled": 0
          },
          {
            "label": "12pm - 2pm",
            "capacity": 3,
            "filled": 0
          }
        ]
      },
      {
        "date": "2026-10-23",
        "weekday": "Friday",
        "status": "red",
        "capacity": 6,
        "filled": 0,
        "fillPct": 0,
        "deepLink": "https://www.signupgenius.com/go/10C084EACAF2BA0FDC43-66263752-canteen#/#842709439-date-wrap",
        "shifts": [
          {
            "label": "10am - 12pm",
            "capacity": 3,
            "filled": 0
          },
          {
            "label": "12pm - 2pm",
            "capacity": 3,
            "filled": 0
          }
        ]
      },
      {
        "date": "2026-10-26",
        "weekday": "Monday",
        "status": "red",
        "capacity": 4,
        "filled": 0,
        "fillPct": 0,
        "deepLink": "https://www.signupgenius.com/go/10C084EACAF2BA0FDC43-66263752-canteen#/#842709405-date-wrap",
        "shifts": [
          {
            "label": "10am - 12pm",
            "capacity": 2,
            "filled": 0
          },
          {
            "label": "12pm - 2pm",
            "capacity": 2,
            "filled": 0
          }
        ]
      },
      {
        "date": "2026-10-27",
        "weekday": "Tuesday",
        "status": "red",
        "capacity": 4,
        "filled": 0,
        "fillPct": 0,
        "deepLink": "https://www.signupgenius.com/go/10C084EACAF2BA0FDC43-66263752-canteen#/#842709406-date-wrap",
        "shifts": [
          {
            "label": "10am - 12pm",
            "capacity": 2,
            "filled": 0
          },
          {
            "label": "12pm - 2pm",
            "capacity": 2,
            "filled": 0
          }
        ]
      },
      {
        "date": "2026-10-28",
        "weekday": "Wednesday",
        "status": "red",
        "capacity": 4,
        "filled": 0,
        "fillPct": 0,
        "deepLink": "https://www.signupgenius.com/go/10C084EACAF2BA0FDC43-66263752-canteen#/#842709407-date-wrap",
        "shifts": [
          {
            "label": "10am - 12pm",
            "capacity": 2,
            "filled": 0
          },
          {
            "label": "12pm - 2pm",
            "capacity": 2,
            "filled": 0
          }
        ]
      },
      {
        "date": "2026-10-29",
        "weekday": "Thursday",
        "status": "red",
        "capacity": 6,
        "filled": 0,
        "fillPct": 0,
        "deepLink": "https://www.signupgenius.com/go/10C084EACAF2BA0FDC43-66263752-canteen#/#842709440-date-wrap",
        "shifts": [
          {
            "label": "10am - 12pm",
            "capacity": 3,
            "filled": 0
          },
          {
            "label": "12pm - 2pm",
            "capacity": 3,
            "filled": 0
          }
        ]
      },
      {
        "date": "2026-10-30",
        "weekday": "Friday",
        "status": "red",
        "capacity": 6,
        "filled": 1,
        "fillPct": 17,
        "deepLink": "https://www.signupgenius.com/go/10C084EACAF2BA0FDC43-66263752-canteen#/#842709441-date-wrap",
        "shifts": [
          {
            "label": "10am - 12pm",
            "capacity": 3,
            "filled": 0
          },
          {
            "label": "12pm - 2pm",
            "capacity": 3,
            "filled": 1
          }
        ]
      },
      {
        "date": "2026-11-02",
        "weekday": "Monday",
        "status": "red",
        "capacity": 4,
        "filled": 0,
        "fillPct": 0,
        "deepLink": "https://www.signupgenius.com/go/10C084EACAF2BA0FDC43-66263752-canteen#/#842709408-date-wrap",
        "shifts": [
          {
            "label": "10am - 12pm",
            "capacity": 2,
            "filled": 0
          },
          {
            "label": "12pm - 2pm",
            "capacity": 2,
            "filled": 0
          }
        ]
      },
      {
        "date": "2026-11-03",
        "weekday": "Tuesday",
        "status": "red",
        "capacity": 4,
        "filled": 0,
        "fillPct": 0,
        "deepLink": "https://www.signupgenius.com/go/10C084EACAF2BA0FDC43-66263752-canteen#/#842709409-date-wrap",
        "shifts": [
          {
            "label": "10am - 12pm",
            "capacity": 2,
            "filled": 0
          },
          {
            "label": "12pm - 2pm",
            "capacity": 2,
            "filled": 0
          }
        ]
      },
      {
        "date": "2026-11-04",
        "weekday": "Wednesday",
        "status": "red",
        "capacity": 4,
        "filled": 0,
        "fillPct": 0,
        "deepLink": "https://www.signupgenius.com/go/10C084EACAF2BA0FDC43-66263752-canteen#/#842709410-date-wrap",
        "shifts": [
          {
            "label": "10am - 12pm",
            "capacity": 2,
            "filled": 0
          },
          {
            "label": "12pm - 2pm",
            "capacity": 2,
            "filled": 0
          }
        ]
      },
      {
        "date": "2026-11-05",
        "weekday": "Thursday",
        "status": "red",
        "capacity": 6,
        "filled": 0,
        "fillPct": 0,
        "deepLink": "https://www.signupgenius.com/go/10C084EACAF2BA0FDC43-66263752-canteen#/#842709442-date-wrap",
        "shifts": [
          {
            "label": "10am - 12pm",
            "capacity": 3,
            "filled": 0
          },
          {
            "label": "12pm - 2pm",
            "capacity": 3,
            "filled": 0
          }
        ]
      },
      {
        "date": "2026-11-06",
        "weekday": "Friday",
        "status": "red",
        "capacity": 6,
        "filled": 1,
        "fillPct": 17,
        "deepLink": "https://www.signupgenius.com/go/10C084EACAF2BA0FDC43-66263752-canteen#/#842709443-date-wrap",
        "shifts": [
          {
            "label": "10am - 12pm",
            "capacity": 3,
            "filled": 0
          },
          {
            "label": "12pm - 2pm",
            "capacity": 3,
            "filled": 1
          }
        ]
      },
      {
        "date": "2026-11-09",
        "weekday": "Monday",
        "status": "red",
        "capacity": 4,
        "filled": 0,
        "fillPct": 0,
        "deepLink": "https://www.signupgenius.com/go/10C084EACAF2BA0FDC43-66263752-canteen#/#842709411-date-wrap",
        "shifts": [
          {
            "label": "10am - 12pm",
            "capacity": 2,
            "filled": 0
          },
          {
            "label": "12pm - 2pm",
            "capacity": 2,
            "filled": 0
          }
        ]
      },
      {
        "date": "2026-11-10",
        "weekday": "Tuesday",
        "status": "red",
        "capacity": 4,
        "filled": 0,
        "fillPct": 0,
        "deepLink": "https://www.signupgenius.com/go/10C084EACAF2BA0FDC43-66263752-canteen#/#842709412-date-wrap",
        "shifts": [
          {
            "label": "10am - 12pm",
            "capacity": 2,
            "filled": 0
          },
          {
            "label": "12pm - 2pm",
            "capacity": 2,
            "filled": 0
          }
        ]
      },
      {
        "date": "2026-11-11",
        "weekday": "Wednesday",
        "status": "red",
        "capacity": 4,
        "filled": 0,
        "fillPct": 0,
        "deepLink": "https://www.signupgenius.com/go/10C084EACAF2BA0FDC43-66263752-canteen#/#842709413-date-wrap",
        "shifts": [
          {
            "label": "10am - 12pm",
            "capacity": 2,
            "filled": 0
          },
          {
            "label": "12pm - 2pm",
            "capacity": 2,
            "filled": 0
          }
        ]
      },
      {
        "date": "2026-11-12",
        "weekday": "Thursday",
        "status": "red",
        "capacity": 6,
        "filled": 0,
        "fillPct": 0,
        "deepLink": "https://www.signupgenius.com/go/10C084EACAF2BA0FDC43-66263752-canteen#/#842709444-date-wrap",
        "shifts": [
          {
            "label": "10am - 12pm",
            "capacity": 3,
            "filled": 0
          },
          {
            "label": "12pm - 2pm",
            "capacity": 3,
            "filled": 0
          }
        ]
      },
      {
        "date": "2026-11-13",
        "weekday": "Friday",
        "status": "red",
        "capacity": 6,
        "filled": 1,
        "fillPct": 17,
        "deepLink": "https://www.signupgenius.com/go/10C084EACAF2BA0FDC43-66263752-canteen#/#842709445-date-wrap",
        "shifts": [
          {
            "label": "10am - 12pm",
            "capacity": 3,
            "filled": 0
          },
          {
            "label": "12pm - 2pm",
            "capacity": 3,
            "filled": 1
          }
        ]
      },
      {
        "date": "2026-11-16",
        "weekday": "Monday",
        "status": "red",
        "capacity": 4,
        "filled": 0,
        "fillPct": 0,
        "deepLink": "https://www.signupgenius.com/go/10C084EACAF2BA0FDC43-66263752-canteen#/#842709414-date-wrap",
        "shifts": [
          {
            "label": "10am - 12pm",
            "capacity": 2,
            "filled": 0
          },
          {
            "label": "12pm - 2pm",
            "capacity": 2,
            "filled": 0
          }
        ]
      },
      {
        "date": "2026-11-17",